Key,Description,en,ko
tut:Basic Flight:Roll31,A tutorial label,Rotate the joystick left or right to roll towards your target,조이스틱을 좌우로 움직여 기체의 롤(roll)을 조종하십시오.
tut:Basic Flight:Pitch32,A tutorial label,Rotate the joystick forward or back to pitch your nose towards it.,조이스틱을 앞뒤로 움직여 기체의 피치(pitch)를 조종하십시오.
tut:Basic Flight:VelVector33,A tutorial label,"This is your velocity vector, showing the direction you are moving.",이것이 속도 벡터입니다. 이것이 현재 움직임의 방향을 보여줍니다.
tut:Basic Flight:VelVector234,A tutorial label,You want to steer velocity vector towards where you want to go.,가고자 하는 곳으로 속도 백터를 이동시키며 비행하십시오.
tut:Basic Flight:FlyToTarget135,A tutorial label,Fly over here!,이곳으로 날아가십시오!
tut:Basic Flight:FlyToTarget236,A tutorial label,Fly over here!,이곳으로 날아가십시오!
tut:Basic Flight:Great Flying37,A tutorial label,Great flying! Now let's try to land at the airbase.,멋진 비행솜씨입니다! 이제 공항에 착륙해 봅시다.
tut:Basic Flight:StartLanding38,A tutorial label,Start your landing here at about [150],착륙을 여기 [150]에서 부터 시작하십시오.
tut:Basic Flight:Landing239,A tutorial label,Line up with the runway and bring speed down to about [100],활주로와 정렬한 뒤 속도를 약 [100] 정도로 감소시키십시오.
tut:Basic Flight:Landing340,A tutorial label,"Flaps down, gear down.  Speed down to [80]","플랩 내리고, 바퀴 내리고, 속도 [80]까지 감속."
tut:Basic Flight:Landing441,A tutorial label,Maintain speed and glide slope.  Keep the vector on target!,속도와 하강을 유지하십시오. 속도 벡터를 목표 활주로에 유지하십시오!
tut:Basic Flight:PrepareToFlare42,A tutorial label,Prepare to flare nose up for a smooth landing,부드러운 착륙을 위해 기수를 높일 준비를 하십시오.
tut:Basic Flight:Flare43,A tutorial label, ,
tut:Basic Flight:Touchdown44,A tutorial label,Touch down! Bring your nose down.,터치다운! 기수를 내리십시오.
tut:Basic Flight:Bring to stop.45,A tutorial label,"Steer down the runway, throttle down and carefully apply brakes.","활주로를 타며, 스토틀을 내리고 천천히 브레이크를 거십시오."
tut:Basic Flight:Done46,A tutorial label,Congratulations!  This concludes the basic flight tutorial.,축하합니다! 이로서 기본 비행 튜토리얼을 마치도록 하겠습니다.
AIM-120D Advanced Radar Missile x2_fullName,Full equip name of: AIM-120D Advanced Radar Missile x2,AIM-120D Advanced Radar Missile x2,AIM-120D 개량된 레이더 미사일 x2
AIM-120D Advanced Radar Missile x2_description,Item description of: AIM-120D Advanced Radar Missile x2,"Two internally mounted, radar guided, medium range air to air missiles.
","내부 무장창에 탑재된, 2발의 레이더 유도 중거리 공대공 미사일 입니다.
"
AGM-145 Ballista x2_fullName,Full equip name of: AGM-145 Ballista x2,AGM-145 Ballista x2,AGM-145 발리스타 x2
AGM-145 Ballista x2_description,Item description of: AGM-145 Ballista x2,"Small anti-tank missiles with advanced optics, ""fire and forget"", and smart self-targeting technology. Can be fired without line of sight to the designated target point, and will acquire hostile targets automatically.","고급 광학 장치, ""발사 후 망각""및 개선된 자가 표적 식별 기술을 탑재한 소형 대전차 미사일. 시야각 외의 지정된 목표 지점까지 발사 할 수 있으며 적대적 표적들을 자동으로 추적합니다."
eqSublabel_LASER-BOMB-INTERNAL,HUD sub-label of an equip,LASER BOMB INTERNAL,LASER BOMB INTERNAL
Mk-82 Bomb x1_fullName,Full equip name of: Mk-82 Bomb x1,Mk-82 Bomb x1,Mk.82 폭탄 x1
Mk-82 Bomb x1_description,Item description of: Mk-82 Bomb x1,Standard un-guided 500lb bomb.,표준형 무유도 500파운드 폭탄입니다.
AIM-120 Advanced Radar Missile x2_fullName,Full equip name of: AIM-120 Advanced Radar Missile x2,AIM-120 Advanced Radar Missile x2,AIM-120 개량된 레이더 미사일 x2
AIM-120 Advanced Radar Missile x2_description,Item description of: AIM-120 Advanced Radar Missile x2,A rack of two radar guided medium range air to air missiles.,2발의 레이더 유도 중거리 공대공 미사일 입니다.
tutName_Vertical Flight,Name of a legacy tutorial objective,Vertical Flight,수직 비행
tutDesc_Vertical Flight,Description of a legacy tutorial,Complete the Vertical Flight tutorial.,수직 비행 튜토리얼을 완료하십시오.
tut:Vertical Flight:Intro10,A tutorial label,Welcome to the Vertical Flight autopilot training.,수직 비행 튜토리얼에 오신것을 환영합니다.
tut:Vertical Flight:Intro21,A tutorial label,"Vertical flight can be tricky, but by using the AP, you will be a master in no time.","수직 비행은 고난이도 기술이지만, 오토파일럿(AP) 기능을 통해 빠른 시간 안에 숙달이 가능합니다."
tut:Vertical Flight:CheckTilt2,A tutorial label,"First, make sure the engines are tilted at 90 degrees.","먼저, 엔진이 90 각도로 틀어져 있는지 확인 하십시오."
tut:Vertical Flight:CheckTilt3,A tutorial label,"First, make sure the engines are tilted at 90 degrees.","먼저, 엔진이 90 각도로 틀어져 있는지 확인 하십시오."
tut:Vertical Flight:EnableHVR4,A tutorial label,Enable HVR mode.,HVR 모드를 활성화 시키십시오.
tut:Vertical Flight:EnableALT5,A tutorial label,Enable ALT mode.,ALT 모드를 활성화 시키십시오.
tut:Vertical Flight:HVRInfo6,A tutorial label,The HVR mode will assist you in staying upright and keeping your horizontal velocity under control.,HVR 모드는 뒤집히지 않도록 보조해주며 수직 속도를 조정해 줍니다.
tut:Vertical Flight:ALTInfo7,A tutorial label,The ALT mode will take control of the engines and convert inputs into climb or descent rates.,ALT 모드는 엔진조정을 담당하며 입력을 상승 혹은 하강 속도로 치환시켜 줍니다.
tut:Vertical Flight:ALTInfo28,A tutorial label,Keeping your throttle centered will hold a hover,스로틀을 중앙에 위치시키면 호버링이 가능합니다
tut:Vertical Flight:ALTInfo39,A tutorial label,Raise or lower the throttle to climb or descend,스로틀을 올리거나 내려서 상승 혹은 하강하십시
tut:Vertical Flight:AltThrottleInfo10,A tutorial label,Altitude Control Status,고도 조정 수치
tut:Vertical Flight:DontTilt11,A tutorial label,Keep your left thumb away from the tilt control.,왼쪽 엄지를 틸트 컨드롤에서 때십시오.
tut:Vertical Flight:DontTilt212,A tutorial label,Any engine tilt less than 90 will disengage HVR AP,90도 이하의 엔진 각도는 자동으로 HVR과 Ap를 비활성화 시킵니다.
tut:Vertical Flight:TakeOffNow13,A tutorial label,Lift throttle now.  Climb to {50} altitude.,스로틀을 올려 {50} 까지 상승하십시오.
tut:Vertical Flight:HoldAltitude14,A tutorial label,Now set your throttle lever to the midpoint to hover.,이제 스로틀을 중앙으로 위치시켜 호버링 하십시오.
tut:Vertical Flight:HoverInfo15,A tutorial label,You should now be in a stable hover,이제 안정적으로 호버링이 가능할 것입니다.
tut:Vertical Flight:HoverInfo216,A tutorial label,You can make adjustments to the throttle to climb or descend as needed.,스로틀을 조정해 상승 혹은 하강이 가능합니다.
tut:Vertical Flight:LatMovementInfo17,A tutorial label,Now you can use the joystick to move around,이제 조이스틱을 움직여 이동이 가능합니다
tut:Vertical Flight:LatMovementInfo218,A tutorial label,The HVR autopilot will handle attitude control,HVR 오토 파일럿이 고도 조정을 자동으로 담당할 것입니
tut:Vertical Flight:LatMovementInfo319,A tutorial label,You just have to tilt the joystick in the direction you want to go,"조이스틱을 움직이기만 하면, 자동으로 가고자 하는 곳으로 이동이 가능합니다."
tut:Vertical Flight:LatMovementInfo420,A tutorial label,You can also twist the joystick to yaw,조이스틱을 비틀어 yaw를 조정 가능합니다.
tut:Vertical Flight:LatMovementHUD21,A tutorial label,Horizontal Velocity Indicator,수직 속도 표시
tut:Vertical Flight:StudyMovement22,A tutorial label,"As you move around, study how the AP handles the vehicle",움직임에 따라 AP가 어떻게 기체를 조정하는지 연구해 보십시오
tut:Vertical Flight:StartTargets23,A tutorial label,Let's try flying into some targets.,이제 목표물들을 향해 움직여 봅시다.
tut:Vertical Flight:HoverWaypoint024,A tutorial label,Hover here!,저곳으로 호버링 하십시오!
tut:Vertical Flight:HoverWaypoint125,A tutorial label,Hover here!,저곳으로 호버링 하십시오!
tut:Vertical Flight:HoverWaypoint226,A tutorial label,Hover here!,저곳으로 호버링 하십시오!
tut:Vertical Flight:HoverWaypoint327,A tutorial label,Hover here!,저곳으로 호버링 하십시오!
tut:Vertical Flight:GoodJob28,A tutorial label,Great! Now lets try to land back on the helipad.,멋집니다! 이제 다시 헬리패드에 착륙해 봅시다.
tut:Vertical Flight:StopBeforeLand29,A tutorial label,"Bring yourself to a stop by centering the throttle, and steering the stick in the opposite direction as your horizontal velocity indicator.",스로틀을 중앙에 정렬시켜 정지한뒤 수직 속도 표시기와 반대 방향으로 스틱을 조정하십시오.
tut:Vertical Flight:FaceLanding30,A tutorial label,Rotate to face towards the helipads.,헬리패드를 향해 회전하십시오.
tut:Vertical Flight:HeadTowardPad31,A tutorial label,Begin to move towards the pad.  Adjust your altitude control and steer so your velocity vector is pointed just above the pad.,헬리패드를 향해 움직이십시오. 고도조정과 스티어링을 조정하며 속도 벡터가 패드 바로 위에 있도록 조정하십시오.
tut:Vertical Flight:AlmostLand32,A tutorial label,Slow your forward speed and rate of descent.,속도와 하강 속도를 감소시키십시오.
tut:Vertical Flight:Land33,A tutorial label,Adjust rate of descent to bring it down gently.,수치를 안정화 시키며 안정적으로 착륙하십시오.
tut:Vertical Flight:Touchdown34,A tutorial label,Touch down!  Throttle down and enable brake locks.,터치다운! 스로틀을 내리고 브레이크 록을 거십시오.
tut:Vertical Flight:Brake Locks35,A tutorial label,Enable brake lock.,브레이크 록을 거십시오.
tut:Vertical Flight:Congrats36,A tutorial label,Congratulations!  Next time: Manual vertical flight and transitioning.,축하합니다! 다음 튜토리얼: 수동 수직 이착륙과 변환
AV-42C_description,Short description of playable vehicle AV-42C,"""Kestrel"" Multi-role VTOL aircraft. Tilting jet nozzles give it the ability to take off and land vertically or horizontally. Large cargo bay and multiple weapon mounts allow for both transport and attack missions.","""Kestrel"" 다목적 수직 이착륙 항공기. 틸팅 엔진 노즐을 사용하면 수직으로 이착륙하거나 수평으로 날 수 있습니다. 대형 화물칸과 여러 개의 무기 랙으로 운송과 공격 임무를 동시에 수행 할 수 있습니다."
F/A-26B_description,Short description of playable vehicle F/A-26B,"""Wasp"" Carrier based air-superiority fighter that can also be configured for ground attack roles.","""Wasp"" 함재기 전투기는 대공은 물론 지상 공격 임무로 무장을 구성 할 수도 있습니다."
F-45A_description,Short description of playable vehicle F-45A,"""Ghost"" Stealthy, single-engine, VTOL/STOVL capable aircraft with four internal bays. Optional external hardpoints can be used to increase carrying capacity when stealth is not needed.","""Ghost"" 스텔스 단일 엔진 수직 / 단거리 이착륙 전투기, 4 개의 내장 무기 베이를 지녔으며, 스텔스가 필요하지 않은 경우 외부 파일론을 사용하여 무기 무장 능력을 높일 수 있습니다."
campaign_av42cTheIsland_name,Name of a campaign.,The Island,섬
campaign_av42cTheIsland_description,Description of a campaign.,The Island campaign.,섬 캠페인
av42cTheIsland:01_preparations_name,Name of a mission.,Preparations,준비 과정
av42cTheIsland:01_preparations_description,Description of a mission.,Help make preparations to defend the island. Transport personnel to coastal SAM site.,섬을 방어하는 과정을 도우십시오. 병력을 해안가의 지대공 사이트로 수송 하십시오.
AV-42C:av42cTheIsland:01_preparations:obj_0:name,A mission objective name,Pick Up,픽업
AV-42C:av42cTheIsland:01_preparations:obj_0:info,Mission objective info.,Let the soldiers into your passenger bay.,병사들을 수송공간에 탑승시키십시오.
AV-42C:av42cTheIsland:01_preparations:obj_1:name,A mission objective name,Drop Off,수송
AV-42C:av42cTheIsland:01_preparations:obj_1:info,Mission objective info.,Drop the soldiers off at the east bay SAM site.,병사들을 SAM 사이트 동쪽에 있는 해안만에 내려주십시오.
AV-42C:av42cTheIsland:01_preparations:obj_2:name,A mission objective name,Join Fighters,전투기들과 합류하십시오
AV-42C:av42cTheIsland:01_preparations:obj_2:info,Mission objective info.,Join up with the fighter escort wing.,전투기 에스코트와 합류하십시
AV-42C:av42cTheIsland:01_preparations:obj_4:name,A mission objective name,Investigate,조사
AV-42C:av42cTheIsland:01_preparations:obj_4:info,Mission objective info.,Investigate the AV-42 crash site.,AV-42 추락 지점을 조사하십시오.
AV-42C:av42cTheIsland:01_preparations:obj_5:name,A mission objective name,Pick-up Survivors,생존자들을 구출하십시오
AV-42C:av42cTheIsland:01_preparations:obj_5:info,Mission objective info.,Pick up the survivors from the crash site.,추락 지점에 있는 생존자들을 구출하십시오.
AV-42C:av42cTheIsland:01_preparations:obj_6:name,A mission objective name,Deliver Survivors,생존자들을 수송
AV-42C:av42cTheIsland:01_preparations:obj_6:info,Mission objective info.,Deliver the survivors to the hospital.,생존자들을 병원으로 수송하십시오
AV-42C:av42cTheIsland:01_preparations:obj_7:name,A mission objective name,RTB,RTB
AV-42C:av42cTheIsland:01_preparations:obj_7:info,Mission objective info.,Return to and land at the airbase.,기지로 귀환하고 공항에 착륙하십시오.
AV-42C:av42cTheIsland:01_preparations:obj_8:name,A mission objective name,Destroy Drones,드론 파괴
AV-42C:av42cTheIsland:01_preparations:obj_8:info,Mission objective info.,Allow the fighters to clear out the hostile drones.,전투기들이 적군 드론을 파괴하도록 허용하십시오.
av42cTheIsland:02_minesweeper_name,Name of a mission.,Minesweeper,지뢰 탐지
av42cTheIsland:02_minesweeper_description,Description of a mission.,Destroy the drone ships laying mines on supply routes.,보급로에 수중 지뢰를 살포하는 드론 선박을 파괴 하십시오.
AV-42C:av42cTheIsland:02_minesweeper:obj_0:name,A mission objective name,Join fighters,전투기들과 합류
AV-42C:av42cTheIsland:02_minesweeper:obj_0:info,Mission objective info.,Meet up with Victor1 at the waypoint.,Victor1과 웨이포인트에서 합류하십시오.
AV-42C:av42cTheIsland:02_minesweeper:obj_1:name,A mission objective name,Fly to AO,작전지역으로 이동
AV-42C:av42cTheIsland:02_minesweeper:obj_1:info,Mission objective info.,Lead the strike group to the area of operations.,공격기들을 작전 영역으로 이끄십시오.
AV-42C:av42cTheIsland:02_minesweeper:obj_2:name,A mission objective name,Strike,공격
AV-42C:av42cTheIsland:02_minesweeper:obj_2:info,Mission objective info.,[Critical] Destroy the mine boats.,[중요] 기뢰정들을 파괴하십시오.
AV-42C:av42cTheIsland:02_minesweeper:obj_3:name,A mission objective name,Support,지원
AV-42C:av42cTheIsland:02_minesweeper:obj_3:info,Mission objective info.,"If able, support your wingmen by destroying the carrier's weapons and drones.",가능하다면 항공 모함의 무기와 드론을 파괴하여 윙맨을 지원하세요.
AV-42C:av42cTheIsland:02_minesweeper:obj_4:name,A mission objective name,RTB,기지로 귀환
AV-42C:av42cTheIsland:02_minesweeper:obj_4:info,Mission objective info.,Return to the airbase.,공군 기지로 돌아갑니다.
av42cTheIsland:03_redirection_name,Name of a mission.,Redirection,리다이렉션
av42cTheIsland:03_redirection_description,Description of a mission.,Join the carrier fleet embarking on a pre-emptive naval strike.,선제 공격을 시작하는 항공 모함 편대에 합류하십시오.
AV-42C:av42cTheIsland:03_redirection:obj_0:name,A mission objective name,Search,탐색
AV-42C:av42cTheIsland:03_redirection:obj_0:info,Mission objective info.,Search for the lost pilot near the objective waypoint.,목표 지점 근처에서 길을 잃은 조종사를 찾으십시오.
AV-42C:av42cTheIsland:03_redirection:obj_1:name,A mission objective name,Join Tanker,공중급유기에 접근
AV-42C:av42cTheIsland:03_redirection:obj_1:info,Mission objective info.,Lead the lost pilot to the refuel tanker.,길 잃은 조종사를 공중급유기로 인도하십시오
AV-42C:av42cTheIsland:03_redirection:obj_2:name,A mission objective name,Refuel,급유
AV-42C:av42cTheIsland:03_redirection:obj_2:info,Mission objective info.,Allow the pilot to refuel.,조종사가 연료를 보급하도록하십시오.
AV-42C:av42cTheIsland:03_redirection:obj_3:name,A mission objective name,Join Carrier,항모에 합류
AV-42C:av42cTheIsland:03_redirection:obj_3:info,Mission objective info.,Lead the pilot to the aircraft carrier.,조종사를 항공 모함으로 안내합니다.
AV-42C:av42cTheIsland:03_redirection:obj_4:name,A mission objective name,Land,착륙
AV-42C:av42cTheIsland:03_redirection:obj_4:info,Mission objective info.,Land on the aircraft carrier.,항공 모함에 착륙하십시오.
av42cTheIsland:04_openWater_name,Name of a mission.,Open Water,Open Water
av42cTheIsland:04_openWater_description,Description of a mission.,Meet the enemy in open water for a pre-emptive strike.,선제 공격을 위해 공해에서 적을 만나십시오.
AV-42C:av42cTheIsland:04_openWater:obj_0:name,A mission objective name,Join Strikers,공격기와 합류
AV-42C:av42cTheIsland:04_openWater:obj_0:info,Mission objective info.,Join the striker group X-Ray1,스트라이커 그룹 X-Ray1에 가입하십시오
AV-42C:av42cTheIsland:04_openWater:obj_1:name,A mission objective name,Defend,방어
AV-42C:av42cTheIsland:04_openWater:obj_1:info,Mission objective info.,Help defend the fleet from the incoming drones.,들어오는 드론으로부터 함대를 방어하십시오.
AV-42C:av42cTheIsland:04_openWater:obj_2:name,A mission objective name,Regroup,합류
AV-42C:av42cTheIsland:04_openWater:obj_2:info,Mission objective info.,Join up with the fighters.,전투기와 합류하십시오.
AV-42C:av42cTheIsland:04_openWater:obj_3:name,A mission objective name,Fly to AO,작전지역으로 이동
AV-42C:av42cTheIsland:04_openWater:obj_3:info,Mission objective info.,Vector to the enemy fleet.,적 함대로 이동.
AV-42C:av42cTheIsland:04_openWater:obj_4:name,A mission objective name,Destroy Targets,목표물 파괴
AV-42C:av42cTheIsland:04_openWater:obj_4:info,Mission objective info.,"Destroy or disable all enemy weapon systems, sensors, and drones.","모든 적의 무기 시스템, 센서 및 드론을 파괴하거나 비활성화하십시오."
AV-42C:av42cTheIsland:04_openWater:obj_5:name,A mission objective name,RTB,기지로 귀환
AV-42C:av42cTheIsland:04_openWater:obj_5:info,Mission objective info.,Return to the fleet and land.,항모나 기지로 돌아가십시오.
av42cTheIsland:05_silentIsland_name,Name of a mission.,Silent Island,Silent Island
av42cTheIsland:05_silentIsland_description,Description of a mission.,Return to the island to investigate why communications have gone silent.,섬으로 돌아가 전파침묵의 이유를 조사하십시오.
AV-42C:av42cTheIsland:05_silentIsland:obj_0:name,A mission objective name,Join Tanker,공중급유기에 접근
AV-42C:av42cTheIsland:05_silentIsland:obj_0:info,Mission objective info.,Take off and fly to the aerial fuel tanker.,이륙하여 공중 연료 유조선으로 날아갑니다.
AV-42C:av42cTheIsland:05_silentIsland:obj_1:name,A mission objective name,Refuel 1,급유 1
AV-42C:av42cTheIsland:05_silentIsland:obj_1:info,Mission objective info.,Allow your Romeo1-1 to refuel.,Romeo1-1에 연료를 보급하십시오.
AV-42C:av42cTheIsland:05_silentIsland:obj_2:name,A mission objective name,Refuel 2,급유 2
AV-42C:av42cTheIsland:05_silentIsland:obj_2:info,Mission objective info.,Allow Romeo1-2 to refuel. Then you may refuel yourself if necessary.,Romeo1-2가 연료를 보급하도록합니다. 그런 다음 필요한 경우 연료를 공급할 수 있습니다.
AV-42C:av42cTheIsland:05_silentIsland:obj_3:name,A mission objective name,Investigate,조사
AV-42C:av42cTheIsland:05_silentIsland:obj_3:info,Mission objective info.,Investigate the island.,섬을 조사하십시오.
AV-42C:av42cTheIsland:05_silentIsland:obj_4:name,A mission objective name,Retreat,후퇴
AV-42C:av42cTheIsland:05_silentIsland:obj_4:info,Mission objective info.,Avoid the enemy fleet. Return to the waypoint and await orders.,적 함대를 피하십시오. 웨이 포인트로 돌아가 명령을 기다립니다.
AV-42C:av42cTheIsland:05_silentIsland:obj_5:name,A mission objective name,CAS,CAS
AV-42C:av42cTheIsland:05_silentIsland:obj_5:info,Mission objective info.,Destroy the armored units moving toward our allied infantry.,아군 보병을 향해 이동하는 장갑 유닛을 파괴하십시오.
AV-42C:av42cTheIsland:05_silentIsland:obj_6:name,A mission objective name,Exfil,Exfil
AV-42C:av42cTheIsland:05_silentIsland:obj_6:info,Mission objective info.,Pick up Bravo squad.,브라보 분대를 픽업하세요.
AV-42C:av42cTheIsland:05_silentIsland:obj_7:name,A mission objective name,RTB,기지로 귀환
AV-42C:av42cTheIsland:05_silentIsland:obj_7:info,Mission objective info.,Return to the aircraft carrier.,항공 모함으로 돌아가십시오.
av42cTheIsland:06_darkness_name,Name of a mission.,Darkness,어둠
av42cTheIsland:06_darkness_description,Description of a mission.,Begin a counterattack under the cover of darkness.,어둠 속에서 반격을 시작하십시오.
AV-42C:av42cTheIsland:06_darkness:obj_0:name,A mission objective name,Begin,시작
AV-42C:av42cTheIsland:06_darkness:obj_0:info,Mission objective info.,Take off and prepare for your anti-ship strike.,이륙하고 대함 공격을 준비하십시오.
AV-42C:av42cTheIsland:06_darkness:obj_1:name,A mission objective name,ASM Strike,ASM 스트라이크
AV-42C:av42cTheIsland:06_darkness:obj_1:info,Mission objective info.,Destroy the long range missile cruiser.,장거리 미사일 순양함을 파괴하십시오.
AV-42C:av42cTheIsland:06_darkness:obj_2:name,A mission objective name,RTB,기지로 귀환
AV-42C:av42cTheIsland:06_darkness:obj_2:info,Mission objective info.,Return to the aircraft carrier.,항공 모함으로 돌아가십시오.
av42cTheIsland:07_islandDefense_name,Name of a mission.,Island Defense,섬 방어
av42cTheIsland:07_islandDefense_description,Description of a mission.,Begin to take back the island and eliminate the enemy fleet off the northern coast.,섬을 되찾고 북쪽 해안에서 적 함대를 제거하십시오.
AV-42C:av42cTheIsland:07_islandDefense:obj_6:name,A mission objective name,AntiShip 2,AntiShip 2
AV-42C:av42cTheIsland:07_islandDefense:obj_6:info,Mission objective info.,Destroy the incoming enemy carrier fleet.,들어오는 적 항모 함대를 파괴하십시오.
AV-42C:av42cTheIsland:07_islandDefense:obj_4:name,A mission objective name,AntiShip,AntiShip
AV-42C:av42cTheIsland:07_islandDefense:obj_4:info,Mission objective info.,Destroy the remaining enemy fleet.,남은 적 함대를 파괴하십시오.
AV-42C:av42cTheIsland:07_islandDefense:obj_3:name,A mission objective name,Airbase,공군 기지
AV-42C:av42cTheIsland:07_islandDefense:obj_3:info,Mission objective info.,Clear out the enemy units at the airbase.,공군 기지에서 적 유닛을 제거하십시오.
AV-42C:av42cTheIsland:07_islandDefense:obj_7:name,A mission objective name,SEAD,대공 제압 임무
AV-42C:av42cTheIsland:07_islandDefense:obj_7:info,Mission objective info.,Destroy the enemy SAM site to allow reinforcements to take off.,증원군이 이륙 할 수 있도록 적의 SAM 사이트를 파괴하십시오.
AV-42C:av42cTheIsland:07_islandDefense:obj_8:name,A mission objective name,Launch,출격
AV-42C:av42cTheIsland:07_islandDefense:obj_8:info,Mission objective info.,,
AV-42C:av42cTheIsland:07_islandDefense:obj_9:name,A mission objective name,Regroup,합류
AV-42C:av42cTheIsland:07_islandDefense:obj_9:info,Mission objective info.,"Rearm if necessary, then regroup with Victor 1.",필요한 경우 재무장하고 Victor 1과 재편성합니다.
AV-42C:av42cTheIsland:07_islandDefense:obj_10:name,A mission objective name,RTB,기지로 귀환
AV-42C:av42cTheIsland:07_islandDefense:obj_10:info,Mission objective info.,Land at the airbase.,공군 기지에 착륙하십시오.
AV-42C:av42cTheIsland:07_islandDefense:obj_11:name,A mission objective name,Drone Boats,드론 보트
AV-42C:av42cTheIsland:07_islandDefense:obj_11:info,Mission objective info.,Destroy the rocket-equipped drone boats threatening the carrier.,항공 모함을 위협하는 로켓이 장착 된 드론 보트를 파괴하십시오.
AV-42C:av42cTheIsland:07_islandDefense:obj_12:name,A mission objective name,Destroy Ship Defense,함선 방어 시스템 파괴
